[
  {
    "id": "804d06a0-f6c4-5077-b593-73a26d343fc3",
    "name": "Streetrat",
    "back_id": "0e5996f5-f324-5113-b524-69741c8f2dfb",
    "image": "form-cards/clawdite-shapeshifter-streetrat.png"
  },
  {
    "id": "23b3259f-1471-59df-a77d-4a2c5c616de3",
    "name": "Senator",
    "back_id": "0e5996f5-f324-5113-b524-69741c8f2dfb",
    "image": "form-cards/clawdite-shapeshifter-senator.png"
  },
  {
    "id": "d4002aa2-fc90-515d-9267-57479ae9ad3b",
    "name": "Scout",
    "back_id": "0e5996f5-f324-5113-b524-69741c8f2dfb",
    "image": "form-cards/clawdite-shapeshifter-scout.png"
  }
]